financial_data,truth_value
"businesses. Many of the Company’ s competito rs seek to compete primarily through aggressive pricing and very low cost structures, and by imitating the",0
Company’ s products and infringing on its intellectual property .®,0
®,0
® SM,0
® ®,0
®,0
® ®,0
Apple Inc. | <DATE> Form <NUM>-K | <NUM>,0
"The Company’ s ability to compete successfully depends heavily on ensuring the continuing and timely introduction of innovative new products, services and",0
"technologies to the marketplace. The Company designs and develops nearly the entire solution for its products, including the hardware, operating system,",0
"numerous software applications and related services. Principal competitive factors important to the Company include price, product and service features",0
"(including security features), relative price and performance, product and service quality and reliability , design innovation, a strong third-party software and",0
"accessories ecosystem, marketing and distribution capability , service and support, and corporate reputation.",0
"The Company is focused  on expanding its market opportunities related to smartphones, persona l computers, tablets, wearables and accessories, and services.",0
"The Company faces substantial competition in these markets from companies that have significant technical, marketing, distribution and other resources, as well",0
"as established hardware, software, and service offerings with large customer bases. In addition, some of the Company’ s competitors have broader product lines,",0
lower-priced products and a larger installed base of active devices. Competition has been particularly intense as competitors have aggressively cut prices and,0
"lowered product margins . Certain competitors have the resources, experience or cost structures to provide products at little or no profit or even at a loss. The",0
Company’ s services compete with business models that provide content to users for free and use illegitimate means to obtain third-party digital content and,0
"applications. The Company faces significant competition as competitors imitate the Company’ s product features and applications within their products, or",0
collaborate to of fer integrated solutions that are more competitive than those they currently of fer.,0
Supply of Components,0
"Although most components essential to the Com pany’ s business are generally available from multiple sources, certain components are currently obtained from",0
"single or limited sources . The Company also competes for various components with other participants in the markets for smartphones, personal computers,",0
"tablets, wearables and accessories. Therefore, many components used by the Company , including those that are available from multiple sources, are at times",0
subject to industry-wide shortage and significant commodity pricing fluctuations.,0
"The Company uses some custom components that are not commonly used by its competitor s, and new products introduced by the Company often utilize",0
"custom components available from only one source. When a component or product uses new technologies, initial capacity constraints may exist until the",0
"suppliers’  yields have matured or their manufact uring capacities have increased. The continued  availability of these components at acceptable prices, or at all,",0
may be affected if suppliers decide to concent rate on the production of common components instead of components customized to meet the Company’ s,0
requirements.,0
"The Company has enter ed into agreements for the supply of many components; however , there can be no guarantee that the Company will be able to extend or",0
"renew these agreements on similar terms, or at all.",0
Research and Development,0
"Because the industries in which the Company competes are characterized by rapid technolog ical advances, the Company’ s ability to compete successfully",0
"depends heavily upon its ability to ensure a continual and timely flow of competitive products, services and technologies to the marketplace. The Company",0
"continues to develop new technologies to enhan ce existing products and services, and to expan d the range of its offerings through research and development",0
"(“R&D”), licensing of intellectual property and acquisition of third-party businesses and technology .",0
Intellectual Property,0
"The Company currently holds a broad collection of intellectual property rights relating to certa in aspects of its hardware devices, accessories, software and",0
"services. This includes patents, designs, copyrights, trademarks and other forms of intellectual property rights in the U.S. and various foreign countries. Although",0
the Company believes the ownership of such intellectual property rights is an important factor in differentiating its business and that its success does depend in,0
"part on such ownership, the Company relies primarily on the innovative skills, technical competence and marketing abilities of its personnel.",0
"The Compa ny regularly files patent, design, copyright and trademark applications to protect innovations arising from its research, development, design and",0
"marketing, and is currently pursuing thousands of applications around the world. Over time, the Company has accumulated a large portfolio of issued and",0
registered intellectual property rights around the world. No single intellectual property right is solely responsible for protecting the Company’ s products and,0
services. The Company believes the duration of its intellectual property rights is adequate relative to the expected lives of its products and services.,0
"In addition to Company-owned intellectual property , many of the Company’ s products and services are designed to include intellectual property owned by third",0
"parties. It may be necessary in the future to seek or renew licenses relating to various aspects of the Company’ s products, processes and services. While the",0
"Company has generally  been able to obtain such licenses on commercially reasonable terms in the past, there is no guarantee that such licenses could be",0
obtained in the future on reasonable terms or at all.,0
Apple Inc. | <DATE> Form <NUM>-K | <NUM>,0
Business Seasonality and Product Introductions,0
The Company has historically experienced higher net sales in its first quarter compared to other quarters in its fiscal year due in part to seasonal holiday,0
"demand. Additionally , new product and service introductions can significantly impact net sales , cost of sales and operating expenses. The timing of product",0
introductions can also impact the Company’ s net sales to its indirect distribution channels as these channels are filled with new inventory following a product,0
"launch, and channel inventory of an older product often declines as the launch of a newer produ ct approaches. Net sales can also be affected when consumers",0
and distributors anticipate a product introduction.,0
Human Capital,0
"The Company believes it has a talented, motiva ted and dedicated team, and works to create an inclusive, safe and supportive environment for all of its team",0
"members. As of <DATE> <NUM> <DATE>, the Company had approximately <NUM> full-time equivalent employees.",0
Workplace Practices and Policies,0
The Company is an equal opportunity employer committed to inclusion and diversity and to providing a workplace free of harassment or discrimination.,0
Compensation and Benefits,0
"The Company believes that compensation should be competitive and equitable, and should enable employees to share in the Company’ s success. The",0
Company recognizes its people are most likely to thrive when they have the resources to meet their needs and the time and support to succeed in their,0
"professional and personal lives. In support of this, the Company offers a wide variety of benefits for employees around the world and invests in tools and",0
resources that are designed to support employees’  individual growth and development.,0
Inclusion and Diversity,0
The Company is comm itted to its vision to build and sustain a more inclusive workforce that is representative of the communities it serves. The Company,0
"continues to work to increase diverse representation at every level, foster an inclusive culture , and support equitable pay and access to opportunity for all",0
employees.,0
Engagement,0
"The Company believes that open and honest  communication among team members, managers and leaders helps create an open, collaborative work",0
"environment where everyone can contribute, grow and succeed. Team members are encouraged to come to their managers with questions, feedback or",0
"concerns, and the Company conducts surveys that gauge employee sentiment in areas like career development, manager performance and inclusivity .",0
Health and Safety,0
The Compa ny is committed to protecting its team members everywhere it operates. The Company identifies potential workplace risks in order to develop,0
"measures to mitigate possible hazards. The Company supports employees with general safety , security and crisis management training, and by putting specific",0
"programs in place for those working in potentially high-hazard environments. Additionally , the Company works to protect the safety and security of its team",0
"members, visitors and customers through its global security team.",0
Available Information,0
"The Compan y’s Annual Reports on Form <NUM>-K, Quarterly Reports on Form <NUM>-Q, Current Reports on Form <NUM>-K, and amendments to reports filed pursuant to",0
"Sections <NUM>(a) and <NUM>(d) of the Securities Exchange Act of <DATE>, as amended (the “Exch ange Act”), are filed with the U.S. Securities and Exchange",0
Commission (the “SEC”). Such reports and other information filed by the Company with the SEC are available free of charge at investor .apple.com/investor-,0
relations/sec-filings/default.aspx when such reports are available on the SEC’ s website. The Company periodically provides certain information for investors on,0
"its corporate website, www .apple.com, and its investor relations website, investor .apple.com. This includes press releases and other information about financial",0
"performance, information on environmental, social and governance matters, and details related to the Company’ s annual meeting of shareholders. The",0
"information contained on the websites reference d in this Form <NUM>-K is not incorporated by reference into this filing. Further , the Company’ s references to website",0
URLs are intended to be inactive textual references only .,0
Apple Inc. | <DATE> Form <NUM>-K | <NUM>,0
Item <NUM>A.    Risk Factors,0
"The Compan y’s busines s, reputation, results of operations, financial condition and stock price can be affected by a number of factors, whether currently known",0
"or unknown,  including those described below . When any one or more of these risks materialize from time to time, the Company’ s business, reputation, results of",0
"operations, financial condition and stock price can be materially and adversely af fected.",0
"Because of the following factors, as well as other factors affecting the Company’ s results of opera tions and financial condition, past financial performance should",0
"not be considered to be a reliable indicator of future performance, and investors should not use historical trends to anticipate results or trends in future periods.",0
This discussion of risk factors contains forward-looking statements.,0
"This section should be read in conjunction with Part II, Item <NUM> “Management’ s Discussion and Analysis of Financial Condition and Results of Operations” and the",0
"consolidated financial statements and accompanying notes in Part II, Item <NUM> “Financial Statements and Supplementary Data” of this Form <NUM>-K.",0
Macroeconomic and Industry Risks,0
The Compa ny’s operations and performance depend significantly on global and regional economic conditions and adverse economic conditions can,0
"materially adversely af fect the Company’ s business, results of operations and financial condition.",0
"The Compa ny has international operations with sales outside the U.S. representing a majority of the Company’ s total net sales. In addition, the Company’ s",0
"global suppl y chain is large and complex and a majority of the Company’ s supplier facilities, including manufacturing and assembly sites, are located outside the",0
"U.S. As a result, the Company’ s operations and performance depend significantly on global and regional economic conditions.",0
"Adverse macroeconomic conditions, including slow growth or recession, high unemploymen t, inflation, tighter credit, higher interest rates, and currency",0
"fluctuations, can adversely impact consumer confidence and spending and materially adverse ly affect demand for the Company’ s products and services. In",0
"addition, consumer confidence and spending can be materially adversely affected in response to changes in fiscal and monetary policy , financial market volatility ,",0
"declines in income or asset values, and other economic factors.",0
"In addition to an adverse  impact on demand for the Company’ s products and services, uncertain ty about, or a decline in, global or regional economic conditions",0
"can have a significant impact on the Company’ s suppliers, contract manufacturers, logistics providers, distributors, cellular network carriers and other channel",0
"partners, and developers. Potential outcomes include financial instability; inability to obtain credit to finance business operations; and insolvency .",0
Adverse economic conditions can also lead to increased credit and collectibility risk on the Company’ s trade receivables; the failure of derivative counterparties,0
and other financial institu tions; limitations on the Company’ s ability to issue new debt; reduced liquidity; and declines in the fair values of the Company’ s financial,0
"instruments. These and other impacts can materially adversely af fect the Company’ s business, results of operations, financial condition and stock price.",0
"The Company’ s business can be impacted by political events, trade and other internation al disputes, war, terrorism, natural disasters, public health",0
"issues, industrial accidents and other business interruptions.",0
"Political events, trade and other international  disputes, war, terrorism, natural disasters, public health issues, industrial accidents and other business",0
"interruptions can harm or disrupt international commerce and the global economy , and could have a material adverse effect on the Company and its customers,",0
"suppliers, contract manufacturers, logistics providers, distributors, cellular network carriers and other channel partners.",0
Apple Inc. | <DATE> Form <NUM>-K | <NUM>,0
"The Company has a large, global business with sales outside the U.S. representing a majority of the Company’ s total net sales, and the Company believes that it",0
generally benefits from growth in international trade. Substantially all of the Company’ s manufacturing is performed in whole or in part by outsourcing partners,0
"located primarily in China mainland, India, Japan, South Korea, Taiwan and Vietnam. Restrictions on international trade, such as tariffs and other controls on",0
"imports or exports of goods, technology or data, can materially adversely affect the Company’ s operations and supply chain and limit the Company’ s ability to",0
offer and distribute its products and services to customers. The impact can be particularly significant if these restrictive measures apply to countries and regions,0
where the Company derives a significant portion of its revenues and/or has significant supply chain operations. Restrictive measures can require the Company,0
"to take various actions, including changing suppliers, restructuring business relationships, and ceasing to offer third-party applications on its platforms. Changing",0
"the Company’ s operations in accordance with new or changed restrictions on international trade can be expensive, time-consuming and disruptive to the",0
Company’ s operations. Such restrictions can be announced with little or no advance notice and the Company may not be able to effectively mitigate all adverse,0
"impacts from such measures. For example, tensions between governments, including the U.S. and China, have in the past led to tariffs and other restrictions",0
"being impos ed on the Company’ s business. If disputes and conflicts further escalate in the future, actions by governments in response could be significantly",0
more severe  and restrictive and could materially adversely affect the Company’ s business. Political uncertainty surrounding trade and other international,0
"disputes could also have a negative ef fect on consumer confidence and spending, which could adversely af fect the Company’ s business.",0
"Many of the Company’ s operations and facilities , as well as critical business operations of the Company’ s suppliers and contract manufacturers, are in locations",0
"that are prone to earth quakes and other natur al disasters. In addition, such operations and facilities are subject to the risk of interruption by fire, power",0
"shortages, nuclear power plant accidents and other industrial accidents, terrorist attacks and other hostile acts, ransomware and other cybersecurity attacks,",0
"labor disputes, public health issues, including pandemics such as the COVID-<NUM> pandemic, and other events beyond the Company’ s control. Global climate",0
"change is resulting in certain types of natural disasters, such as droughts, floods, hurricanes  and wildfires, occurring more frequently or with more intense",0
"effects. Such  events can make it difficult or impo ssible for the Company to manufacture and deliver products to its customers, create delays and inefficiencies in",0
"the Compan y’s supply and manufacturing chain , and result in slowdowns and outages to the Company’ s service offerings, and negatively impact consumer",0
"spending and demand in affected areas. Following an interruption to its business, the Compan y can require substantial recovery time, experience significant",0
"expenditures to resume operations, and lose significant sales. Because the Company relies on single or limited sources for the supply and manufacture of many",0
"critical components, a business interruption af fecting such sources would exacerbate any negative consequences to the Company .",0
The Compan y’s operations are also subject to the risks of industrial accidents at its suppliers and contract manufacturers. While the Company’ s suppliers are,0
"required to maintain safe working environments and operations, an industrial accident could occur and could result in serious injuries or loss of life, disruption to",0
"the Compan y’s business, and harm to the Com pany’ s reputation. Major public health issues, including pandemics such as the COVID-<NUM> pandemic, have",0
"adversely affected, and could in the future materially adversely affect, the Company due to their impact on the global economy and demand for consumer",0
"products; the imposition of protective public safety measures, such as stringent employee travel restrictions and limitations on freight services and the movement",0
"of products between regions; and disruptions in the Company’ s operations, supply chain and sales and distribution channels, resulting in interruptions to the",0
"supply of current products and of fering of existing services, and delays in production ramps of new products and development of new services.",0
"While the Company maintains insurance coverage for certain types of losses, such insurance coverage may be insuf ficient to cover all losses that may arise.",0
"Global markets for the Company’ s products and services are highly competitive and subje ct to rapid technological change, and the Company may be",0
unable to compete ef fectively in these markets.,0
The Company’ s products and services are offered in highly competitive global markets characterized by aggressive price competition and resulting downward,0
"pressure on gross marg ins, frequent introduction of new products and services, short product life cycles, evolving industry standards, continual improvement in",0
"product price  and performance characteristics, rapid adoption of technological advancements by competitors, and price sensitivity on the part of consumers and",0
businesses.,0
"The Company’ s ability to compete successfully depends heavily on ensuring the continuing and timely introduction of innovative new products, services and",0
"technologies to the marketplace. The Company designs and develops nearly the entire solution for its products, including the hardware, operating system,",0
"numerous software applications and related services. As a result, the Company must make significant investments in R&D. There can be no assurance these",0
"investments will achieve expected returns, and the Company may not be able to develop and market new products and services successfully .",0
Apple Inc. | <DATE> Form <NUM>-K | <NUM>,0
"The Compa ny currently holds a significant number of patents, trademarks and copyrights and has registered, and applied to register , additional patents,",0
"trademarks and copyrights. In contrast, many of the Company’ s competitors seek to compete primarily through aggressive pricing and very low cost structures,",0
and by imitating the Company’ s products and infringing on its intellectual property . Effective intellectual property protection is not consistently available in every,0
country in which the Company operates. If the Company is unable to continue to develop and sell innovative new products with attractive margins or if,0
"competitors infringe on the Company’ s intellectual property , the Company’ s ability to maintain a competitive advantage could be materially adversely af fected.",0
"The Company has a minority market share in the global smartphone, personal computer and tablet markets. The Company faces substantial competition in",0
"these markets from companies that have significant technical, marketing, distribution and other resources, as well as established hardware, software and digital",0
"content supplier relationships. In addition, some  of the Company’ s competitors have broader product lines, lower-priced products and a larger installed base of",0
active device s. Competition has been particularly intense as competitors have aggressively cut prices and lowered product margins. Certain competitors have,0
"the resources, experience or cost structures to provide products at little or no profit or even at a loss. Some of the markets in which the Company competes have",0
from time to time experienced little to no growth or contracted overall.,0
"Additionally , the Company faces significant competition as competitors imitate the Company’ s product features and applications within their products or",0
collaborate to offer solutions that are more comp etitive than those they currently offer. The Company also expects competition to intensify as competitors imitate,0
the Company’ s approach to providing components seamlessly within their of ferings or work collaboratively to of fer integrated solutions.,0
"The Compa ny’s services also face substantial competition, including from companies that have significant resources and experience and have established",0
service offerings with large customer bases. The Company competes with business models that provide content to users for free. The Company also competes,0
with illegitimate means to obtain third-party digital content and applications.,0
"The Company’ s business, results of operations  and financial condition depend substantially on the Company’ s ability to continually improve its products and",0
services to maintain their functional and design advantages. There can be no assurance the Com pany will be able to continue to provide products and services,0
that compete ef fectively .,0
Business Risks,0
"To remain competitive and stimulate customer demand, the Company must successfully manage frequent introductions and transitions of products",0
and services.,0
"Due to the highly volatile and competitive nature  of the markets and industries in which the Company competes, the Company must continually introduce new",0
"products, services and technologies, enhance existing products and services, effectively stimulate customer demand for new and upgraded products and",0
"services, and successfully manage the transitio n to these new and upgraded products and services. The success of new product and service introductions",0
"depends on a number of factors, including timel y and successful development, market acceptance, the Company’ s ability to manage the risks associated with",0
"new technol ogies and production ramp-up issue s, the availability of application software for the Company’ s products, the effective management of purchase",0
"commitments and inventory levels in line with anticipated product demand, the availability of products in appropriate quantities and at expected costs to meet",0
"anticipated demand, and the risk that new produ cts and services may have quality or other defects or deficiencies. There can be no assurance the Company will",0
successfully manage future introductions and transitions of products and services.,0
"The Company depends on component and product manufacturing and logistical servic es provided by outsourcing partners, many of which are",0
located outside of the U.S.,0
"Substantially all of the Company’ s manufacturing is performed in whole or in part by outsourcing partners located primarily in China mainland, India, Japan,",0
