financial_data,truth_value
"vendors’  systems and services. To help protect customers and the Company , the Compan y deploys and makes available technologies like multifactor",0
"authentication, monitors its services and system s for unusual activity and may freeze accounts under suspicious circumstances, which, among other things, can",0
result in the delay or loss of customer orders or impede customer access to the Company’ s products and services.,0
"While the Company maintains insurance coverag e that is intended to address certain aspects of data security risks, such insurance coverage may be insuf ficient",0
to cover all losses or all types of claims that may arise.,0
Apple Inc. | <DATE> Form <NUM>-K | <NUM>,0
"Investment in new business strategies and acquisitions could disrupt the Company’ s ongoing business, present risks not originally contemplated",0
"and materially adversely af fect the Company’ s business, reputation, results of operations and financial condition.",0
"The Company has invested, and in the future may invest, in new business strategies or acquisitions. Such endeavors may involve significant risks and",0
"uncertainties, including distraction of management from current operations, greater-than-expected liabilities and expenses, economic, political, legal and",0
"regulatory challenges associated with operating  in new businesses, regions or countries, inadequate return on capital, potential impairment of tangible and",0
"intangible assets, and significant write-of fs. Investment and acquisition transactions are exposed to additional risks, including failing to obtain required regulatory",0
"approvals on a timely basis or at all, or the imposition of onerous conditions that could delay or prevent the Company from completing a transaction or otherwise",0
limit the Com pany’ s ability to fully realize the anticipated benefits of a transaction. These new ventures are inherently risky and may not be successful. The,0
"failure of any significant investment could materially adversely af fect the Company’ s business, reputation, results of operations and financial condition.",0
The Company’ s retail stores are subject to numerous risks and uncertainties.,0
"The Compan y’s retail operations are subject to many factors that pose risks and uncertainties and could adversely impact the Company’ s business, results of",0
"operations and financial condition, including macroeconomic factors that could have an adverse effect on general retail activity . Other factors include the",0
Company’ s ability to: manage costs associated  with retail store construction and operation; manage relationships with existing retail partners; manage costs,0
associated with fluctuations in the value of retail inventory; and obtain and renew leases in quality retail locations at a reasonable cost.,0
Legal and Regulatory Compliance Risks,0
"The Company’ s business, results of operatio ns and financial condition could be adversely impacted by unfavorable results of legal proceedings or",0
government investigations.,0
"The Company is subject  to various claims, legal proceedings and government investigations that have arisen in the ordinary course of business and have not yet",0
"been fully resolved, and new matters may arise in the future. In addition, agreements entered into by the Company sometimes include indemnification provisions",0
"which can subject the Company to costs and damages in the event of a claim against an indem nified third party . The number of claims, legal proceedings and",0
"government investigatio ns involving the Company , and the alleged magnitude of such claim s, proceedings and government investigations, has generally",0
increased over time and may continue to increase.,0
"The Company has faced  and continues to face a significant number of patent claims relating to its cellular-enabled products, and new claims may arise in the",0
"future, including as a result of new legal or regulatory frameworks. For example, technology and other patent-holding companies frequently assert their patents",0
and seek royalties and often enter into litigation  based on allegations of patent infringement or other violations of intellectual property rights. The Company is,0
"vigorously defending infringement actions in courts in several U.S. jurisdictions, as well as internationally in various countries. The plaintif fs in these actions",0
frequently seek injunctions and substantial damages.,0
"Regardless of the merit of particular claims, defending against litigation or responding to government investigations can be expensive, time-consuming and",0
"disruptive to the Compan y’s operations. In recog nition of these considerations, the Company may enter into agreements or other arrangements to settle litigation",0
and resolve  such challenges. There can be no assurance such agreements can be obtaine d on acceptable terms or that litigation will not occur . These,0
agreements can also significantly increase the Company’ s cost of sales and operating expenses and require the Company to change its business practices and,0
limit the Company’ s ability to of fer certain products and services.,0
"Except as described in Part I, Item <NUM> of this Form <NUM>-K under the heading “Legal Proceedings” and in Part II, Item <NUM> of this Form <NUM>-K in the Notes to",0
"Consolidated Financial Statements in Note <NUM> “Commitments, Contingencies and Supply Concentrations” under the heading “Contingencies,” in the opinion of",0
"management, there was not at least a reasonabl e possibility the Company may have incurred a material loss, or a material loss greater than a recorded accrual,",0
concerning loss contingencies for asserted legal and other claims.,0
The outcome of litigation  or government investiga tions is inherently uncertain. If one or more legal matters were resolved against the Company or an indemnified,0
"third party in a reporting period for amounts above management’ s expectations, the Company’ s results of operations and financial condition for that reporting",0
"period could be materi ally adversely affected. Further , such an outcome can result in significant compensatory , punitive or trebled monetary damages,",0
"disgorgement of revenue or profits, remedial corporate measures or injunctive relief against the Company , and has from time to time required, and can in the",0
"future requir e, the Company to change its business practices and limit the Company’ s ability to offer certain products and services, all of which could materially",0
"adversely af fect the Company’ s business, reputation, results of operations and financial condition.",0
"While the Company maintains insurance coverage for certain types of claims, such insurance coverage may be insuf ficient to cover all losses or all types of",0
claims that may arise.,0
Apple Inc. | <DATE> Form <NUM>-K | <NUM>,0
"The Compa ny is subject to complex and changing laws and regulations worldwide, which exposes the Company to potential liabilities, increased",0
costs and other adverse ef fects on the Company’ s business.,0
"The Company’ s global operations are subject to complex and changing laws and regulations on subjects, including antitrust; privacy , data security and data",0
"localization; consumer protection; advertising, sales, billing and e-commerce; financial services and technology; product liability; intellectual property ownership",0
"and infringement; digital platforms; machine learning and artificial intelligence; internet, telecommunications and mobile communications; media, television, film",0
"and digital content; availability of third-party software applications and services; labor and employment; anticorruption; import, export and trade; foreign",0
"exchange controls and cash repatriation restric tions; anti–money laundering; foreign ownership and investment; tax; and environmental, health and safety ,",0
"including electronic waste, recycling, product design and climate change.",0
Compliance with these laws and regulations is onerous and expensive. New and changing laws and regulations can adversely affect the Company’ s business by,0
"increasing the Company’ s costs, limiting the Company’ s ability to offer a product, service or feature to customers, imposing changes to the design of the",0
"Company’ s products and services, impacting customer demand for the Company’ s products and services, and requiring changes to the Company’ s supply chain",0
and its business. New and changing laws and regulations can also create uncertainty about how such laws and regulations will be interpreted and applied.,0
"These risks and costs may increase as the Company’ s products and services are introduced into specialized applications, including health and financial",0
"services. The Company has implemented polici es and procedures designed to ensure compliance with applicable laws and regulations, but there can be no",0
"assurance the Company’ s employees, contractors or agents will not violate such laws and regulations or the Company’ s policies and procedures. If the",0
"Company is found to have violated laws and regulations, it could materially adversely affect the Company’ s business, reputation, results of operations and",0
financial condition. Regulatory changes and other actions that materially adversely affect the Company’ s business may be announced with little or no advance,0
"notice and the Company may not be able to effectively mitigate all adverse impacts from such measures. For example, the Company is subject to changing",0
"regulations relating to the export and import of its products. Although the Company has programs, policies and procedures in place that are designed to satisfy",0
"regulatory requirements, there can be no assurance that such policies and procedures will be effective in preventing a violation or a claim of a violation. As a",0
"result, the Company’ s products could be bann ed, delayed or prohibited from importation, which could materially adversely affect the Company’ s business,",0
"reputation, results of operations and financial condition.",0
"Expectations relating to environmental, social and governance considerations and related reporting obligations expose the Company to potential",0
"liabilities, increased costs, reputational harm, and other adverse ef fects on the Company’ s business.",0
"Many governments, regulators, investors, employees, customers and other stakeholders are increasingly focused on environmental, social and governance",0
"considerations relating to businesses, including climate change and greenhouse gas emissions, human and civil rights, and diversity , equity and inclusion. In",0
"addition, the Company makes statements abou t its goals and initiatives through its various non-financial reports, information provided on its website, press",0
"statements and other communications. Responding to these environmental, social and gover nance considerations and implementation of these goals and",0
"initiatives involves risks and uncertainties, requir es investments, and depends in part on third-pa rty performance or data that is outside the Company’ s control.",0
"The Compan y cannot guarantee that it will achieve its announced environmental, social and governance goals and initiatives. In addition, some stakeholders",0
"may disagree with the Company’ s goals and initiatives. Any failure, or perceived failure, by the Company to achieve its goals, further its initiatives, adhere to its",0
"public statements, comply with federal, state or international environmental, social and governance laws and regulations, or meet evolving and varied",0
stakeholder expectations and standards could result in legal and regulatory proceedings against the Company and materially adversely affect the Company’ s,0
"business, reputation, results of operations, financial condition and stock price.",0
"The techno logy indust ry, including, in some instances, the Company , is subject to intense media, political and regulatory scrutiny , which exposes",0
"the Company to increasing regulation, government investigations, legal actions and penalties.",0
"From time to time, the Company has made changes to its App Store, including actions taken in response to litigation, competition, market conditions and legal",0
"and regulato ry requirem ents. The Company expects to make further business changes in the future, including as a result of legislative initiatives impacting the",0
"App Store, such as the EU Digital <DATE> Act, which the Company is required to comply with by <DATE> <DATE>, or similar laws in other jurisdictions. Changes",0
have included how deve lopers communicate with consumers outside the App Store regarding alternative purchasing mechanisms. Future changes could also,0
"affect what the Compan y charges developers for access to its platforms, how it manages distribution of apps outside of the App Store, and how and to what",0
extent it allows developers to communicate with consumers inside the App Store regarding alternative purchasing mechanisms.,0
Apple Inc. | <DATE> Form <NUM>-K | <NUM>,0
"The Company is also currently subject to antitrust investigations in various jurisdictions aroun d the world, which can result in legal proceedings and claims",0
"against the Company that could, individually or in the aggregate, have a materially adverse impact on the Company’ s business, results of operations and",0
"financial condition. For example, the Company is the subject of investigations in Europe and other jurisdictions relating to App Store terms and conditions. If such",0
"investigations result in adverse findings against the Company , the Company could be exposed to significant fines and may be required to make changes to its",0
"App Store business, all of which could materially adversely affect the Company’ s business, results of operations and financial condition. The Company is also",0
"subject to litigation relating to the App Store, which has resulted in changes to the Company’ s business practices, and may in the future result in further changes.",0
"Further , the Company has commercial relations hips with other companies in the technology industry that are or may become subject to investigations and",0
"litigation that, if resolved against those other companies, could materially adversely affect the Company’ s commercial relationships with those business partners",0
"and material ly adversely affect the Company’ s business, results of operations and financial cond ition. For example, the Company earns revenue from licensing",0
"arrangements with other companies to offer their search services on the Company’ s platforms and applications, and certain of these arrangements are currently",0
subject to government investigations and legal proceedings.,0
"There can be no assurance the Company’ s business will not be materially adversely affected, individually or in the aggregate, by the outcomes of such",0
"investigations, litigation or changes to laws and regulations in the future. Changes to the Compan y’s business practices to comply with new laws and regulations",0
or in connection with other legal proceedings could negatively impact the reputation of the Company’ s products for privacy and security and otherwise adversely,0
"affect the experience for users of the Company’ s products and services, and result in harm to the Company’ s reputation, loss of competitive advantage, poor",0
"market acceptance, reduced demand for products and services, and lost sales.",0
"The Company’ s business is subject to a variety of U.S. and international laws, rules, policies and other obligations regarding data protection.",0
"The Company is subject  to an increasing number of federal, state and international laws relating  to the collection, use, retention, security and transfer of various",0
"types of personal inform ation. In many cases, these laws apply not only to third-party transactio ns, but also restrict transfers of personal information among the",0
"Company and its international subsidiaries. Several jurisdictions have passed laws in this area, and additional jurisdictions are considering imposing additional",0
restrictions or have laws that are pending. These laws continue to develop and may be inconsistent from jurisdiction to jurisdiction. Complying with emerging and,0
changing requirements causes the Company to incur substantial costs and has required and may in the future require the Company to change its business,0
practices. Noncompliance could result in significant penalties or legal liability .,0
"The Compa ny makes statements about its use and disclosure of personal information through its privacy policy , information provided on its website, press",0
"statements and other privacy notices provided to customers. Any failure by the Company to comply with these public statements or with other federal, state or",0
international privacy or data protection laws and regulations could result in inquiries or proceedin gs against the Company by governmental entities or others. In,0
"addition to reputational impacts, penalties could include ongoing audit requirements and significant legal liability .",0
"In addition to the risks generally relating to the collection, use, retention, security and transfer of personal information, the Company is also subject to specific",0
"obligations relating to information considered sensitive under applicable laws, such as health data, financial data and biometric data. Health data and financial",0
"data are subject to addit ional privacy , security and breach notification requirements, and the Company is subject to audit by governmental authorities regarding",0
"the Company’ s compliance with these obligations. If the Company fails to adequately comply with these rules and requirements, or if health data or financial data",0
"is handled in a manner not permitted by law or under the Company’ s agreements with healthcare or financial institutions, the Company can be subject to",0
"litigation or government investigations, and can be liable for associated investigatory expenses, and can also incur significant fees or fines.",0
"Payment card data is also subject to additional requirements. Under payment card rules and obligations, if cardholder information is potentially compromised,",0
the Company can be liable for associated investigatory expenses and can also incur significant fees or fines if the Company fails to follow payment card industry,0
data security  standards.  The Company could also experience a significant increase in paymen t card transaction costs or lose the ability to process payment,0
"cards if it fails to follow payment card industry data security standards, which could materially adversely affect the Company’ s business, reputation, results of",0
operations and financial condition.,0
Apple Inc. | <DATE> Form <NUM>-K | <NUM>,0
Financial Risks,0
The Company expects its quarterly net sales and results of operations to fluctuate.,0
"The Compa ny’s profit margins vary across its products, services, geographic segments and distribution channels. For example, the gross margins on the",0
Company’ s products and services vary significantly and can change over time. The Company’ s gross margins are subject to volatility and downward pressure,0
"due to a variety of factors, including: continued industry-wide global product pricing pressure s and product pricing actions that the Company may take in",0
response to such pressu res; increased competition; the Company’ s ability to effectively stimulate demand for certain of its products and services; compressed,0
"product life cycles; supply shortages; potential increases in the cost of components, outside manufacturing services, and developing, acquiring and delivering",0
"content for the Company’ s services; the Compan y’s ability to manage product quality and warran ty costs effectively; shifts in the mix of products and services, or",0
"in the geographic, curre ncy or channel mix, including to the extent that regulatory changes require the Company to modify its product and service offerings;",0
"fluctuations in foreign exchange rates; inflation and other macroeconomic pressures; and the introduction of new products or services, including new products or",0
services with higher cost structures. These and other factors could have a materially adverse impact on the Company’ s results of operations and financial,0
condition.,0
The Company has historically experienced higher net sales in its first quarter compared to other quarters in its fiscal year due in part to seasonal holiday,0
"demand. Additionally , new product and service introductions can significantly impact net sales, cost of sales and operating expenses. Further , the Company",0
generates a significant portion of its net sales from a single product and a decline in demand for that product could significantly impact quarterly net sales. The,0
"Company could also be subject to unexpected developments, such as lower-than-anticipated demand for the Company’ s products or services, issues with new",0
"product or service introductions, information technology system failures or network disruptions, or failure of one of the Company’ s logistics, components supply ,",0
or manufacturing partners.,0
The Company’ s financial performance is subject to risks associated with changes in the value of the U.S. dollar relative to local currencies.,0
"The Compan y’s primary exposure to movements  in foreign exchange rates relates to non–U.S. dollar–denominated sales, cost of sales and operating expenses",0
worldwide. Gross margins on the Company’ s products in foreign countries and on products that include components obtained from foreign suppliers have in the,0
past been adversely af fected and could in the future be materially adversely af fected by foreign exchange rate fluctuations.,0
The weakening of foreign currencies relative to the U.S. dollar adversely affects the U.S. dollar value of the Company’ s foreign currency–denominated sales and,0
"earnings, and generally leads the Company to raise international pricing, potentially reducing demand for the Company’ s products. In some circumstances, for",0
"competitive or other reasons, the Company may decide not to raise international pricing to offset the U.S. dollar ’s strengthening, which would adversely affect",0
the U.S. dollar value of the gross margins the Company earns on foreign currency–denominated sales.,0
"Conversely , a strengthening of foreign currencies  relative to the U.S. dollar , while generally beneficial to the Company’ s foreign currency–denominated sales and",0
"earnings, could cause the Company to reduce international pricing or incur losses on its foreig n currency derivative instruments, thereby limiting the benefit.",0
"Additionally , strengthening of foreign currencies may increase the Company’ s cost of product components denominated in those currencies, thus adversely",0
affecting gross margins.,0
"The Company uses derivative instruments, such as foreign currency forward and option contracts, to hedge certain exposures to fluctuations in foreign",0
"exchange rates. The use of such hedging activities may not be effective to offset any, or more  than a portion, of the adverse financial effects of unfavorable",0
movements in foreign exchange rates over the limited time the hedges are in place.,0
The Company is exposed to credit risk and fluctuations in the values of its investment portfolio.,0
"The Company’ s investments can be negatively affected by changes in liquidity , credit deteriorat ion, financial results, market and economic conditions, political",0
"risk, sovereign risk, interest rate fluctuations or other factors. As a result, the value and liquidity of the Company’ s cash, cash equivalents and marketable",0
"securities may fluctuate substantially . Therefore , although the Company has not realized any significant losses on its cash, cash equivalents and marketable",0
"securities, future fluctuations in their value could result in significant losses and could have a material adverse impact on the Company’ s results of operations",0
and financial condition.,0
Apple Inc. | <DATE> Form <NUM>-K | <NUM>,0
"The Compa ny is exposed to credit risk on its trade accounts receivable, vendor non-trade receivables and prepayments related to long-term supply",0
"agreements, and this risk is heightened during periods when economic conditions worsen.",0
"The Company distributes its products and certai n of its services through third-party cellular netw ork carriers, wholesalers, retailers and resellers. The Company",0
"also sells its products and services directly to small and mid-sized businesses and education, enterprise and government customers. A substantial majority of the",0
"Company’ s outstanding trade receivables are not covered by collateral, third-party bank support or financing arrangements, or credit insurance, and a significant",0
portion of the Company’ s trade receivables can be concentrated within cellular network carriers or other resellers. The Company’ s exposure to credit and,0
collectibility risk on its trade receivables is highe r in certain international markets and its ability  to mitigate such risks may be limited. The Company also has,0
unsecured vendor non-trade receivables resulting from purchases of components by outsourcing partners and other vendors that manufacture subassemblies or,0
"assemble final products for the Company . In addition, the Company has made prepayments associated with long-term supply agreements to secure supply of",0
"inventory components. As of <DATE> <NUM> <DATE>, the Company’ s vendor non-trade receivables  and prepayments related to long-term supply agreements were",0
